{
  "schema": "kage.shot/1", "id": "shot_s01_010", "scene": "scn_01", "version": "1.0.0", "status": "approved",
  "covers": ["evt_02"], "purpose": "Establish the journey, the hour (sunset) and the direction of travel.",
  "duration_s": 4.0, "timing": {"flex": false},
  "cast": [],
  "props": [
    {"id": "prop_bird_1", "asset": "ast_bird", "layer": "far", "keys": [{"t": 0, "x": -8.5, "y": 5.2}, {"t": 4.0, "x": 6.5, "y": 5.9, "ease": "linear"}]},
    {"id": "prop_bird_2", "asset": "ast_bird", "layer": "far", "keys": [{"t": 0, "x": -9.3, "y": 4.8}, {"t": 4.0, "x": 5.6, "y": 5.4, "ease": "linear"}], "scale": 0.85},
    {"id": "prop_bird_3", "asset": "ast_bird", "layer": "far", "keys": [{"t": 0, "x": -7.8, "y": 5.6}, {"t": 4.0, "x": 7.4, "y": 6.3, "ease": "linear"}], "scale": 0.7}
  ],
  "camera": {
    "framing": "custom", "angle": "eye",
    "keys": [{"t": 0, "x": -0.6, "y": 3.0, "height": 8.2}, {"t": 4.0, "x": 0.4, "y": 3.1, "height": 7.6, "ease": "in_out"}],
    "variants": {"9:16": {"keys": [{"t": 0, "x": -0.4, "y": 4.4, "height": 12.5}, {"t": 4.0, "x": 0.4, "y": 4.4, "height": 11.8, "ease": "in_out"}]}}
  },
  "dialogue": [],
  "transition_in": {"type": "fade", "duration_s": 1.0, "color": "#000000"},
  "transition_out": {"type": "cut"},
  "continuity": {"offscreen": [], "entrances": [], "exits": []},
  "framing": {"allow_partial": ["inst_train", "inst_hills_far", "inst_trees", "inst_ground", "inst_sleepers", "prop_bird_1", "prop_bird_2", "prop_bird_3"]}
}
