{
  "schema": "kage.shot/1",
  "id": "shot_s02_040",
  "scene": "scn_02",
  "version": "1.0.0",
  "status": "approved",
  "covers": [
    "evt_09"
  ],
  "purpose": "Resolution: Lila leans on Maya's shoulder; the light fades as the train rolls on.",
  "duration_s": 5.5,
  "timing": {
    "flex": false
  },
  "cast": [
    {
      "character": "chr_maya",
      "z": 0.0,
      "start": {
        "x": "@seat_maya",
        "facing": "right",
        "posture": "sit",
        "seat_y": "@seat_maya"
      },
      "actions": [
        {
          "type": "lean",
          "start": 1.8,
          "duration": 1.4,
          "hold": true,
          "spine": 4,
          "neck": 14,
          "shift_x": 0.03
        }
      ]
    },
    {
      "character": "chr_lila",
      "z": 0.2,
      "start": {
        "x": "@seat_lila",
        "facing": "left",
        "posture": "sit",
        "seat_y": "@seat_lila"
      },
      "actions": [
        {
          "type": "lean",
          "start": 0.8,
          "duration": 1.6,
          "hold": true,
          "spine": 16,
          "neck": 30,
          "shift_x": 0.22
        }
      ]
    }
  ],
  "props": [],
  "camera": {
    "framing": "medium",
    "subjects": [
      "chr_maya",
      "chr_lila"
    ],
    "angle": "eye",
    "move": {
      "type": "zoom",
      "factor": 0.88
    },
    "variants": {
      "9:16": {
        "framing": "medium",
        "subjects": [
          "chr_maya",
          "chr_lila"
        ],
        "move": {
          "type": "zoom",
          "factor": 0.9
        }
      }
    }
  },
  "dialogue": [],
  "transition_in": {
    "type": "cut"
  },
  "transition_out": {
    "type": "fade",
    "duration_s": 1.8,
    "color": "#000000"
  },
  "continuity": {
    "offscreen": [
      "chr_conductor"
    ],
    "entrances": [],
    "exits": []
  },
  "framing": {
    "allow_partial": [
      "inst_wall",
      "inst_view_hills",
      "inst_view_trees",
      "inst_bench"
    ]
  }
}
